<?xml version="1.0" encoding="UTF-8"?>
<!-- example grvl XML for XML Schema validation -->
<!-- it is valid for the XML Schema shipped with grvl -->
<doc xmlns:xsi="http://www.w3.org/2001/XMLSchema-instance" xsi:noNamespaceSchemaLocation="grvl.xsd">
    <stylesheet>
        guiConfig {
            bgColor: "red"
        }
    </stylesheet>
	<script src="callbacks.js" />
    <guiConfig dotColor="#ffffffff"></guiConfig>
    <keypadMapping>
        <key id="enter" code="13" />
        <key id="escape" code="27" />
    </keypadMapping>
    <header height="50" backgroundColor="#ff000000">
        <label id="h_label" textColor="#ffffffff" text="Header (Label)" font="roboto-medium" alignment="Center" x="0" y="0" width="800" height="50" />
    </header>
    <popup id="test_popup" backgroundColor="#ff000000" x="250" y="200" width="300" height="200">
        <button id="close_popup_btn" x="100" y="10" width="100" height="50" backgroundColor="#ffffffff" textColor="#ff0000ff" activeTextColor="#ffff00ff" onClick="ClosePopup" text="Close" font="roboto-medium" />
        <label id="popup_label" font="roboto-medium" x="0" y="100" width="300" textColor="#ffffffff" height="50" text="This is a Popup. Hold ESCAPE to close it." />
    </popup>
    <customView id="start" backgroundColor="#FF4287F5">
	    <button id="test_button" image="button_image" x="10" y="10" width="100" height="100" textColor="#ff00ff00" activeTextColor="#ffff00ff" onClick="ButtonCallback" text="TEST" font="roboto-medium" />
        <clock id="test_clock" x="150" y="10" width="100" height="100" font="roboto-medium" foregroundColor="#fffff000" format="%H:%M:%S" />
        <slider id="vertical_slider" x="300" y="10" width="20" height="100" scrollColor="#ffff0000" activeBarColor="#ff00ff00" />
        <slider id="horizontal_slider" x="340" y="10" width="100" height="20" scrollColor="#fffcba03" activeBarColor="#ffa903fc" />
        <label id="popup_label" font="roboto-medium" x="0" y="100" width="300" height="50" text="Press ENTER to open a popup." />
        <GridView id="grid_view" x="350" y="120" width="100" height="100" elementWidth="50" elementHeight="50">
            <GridRow id="row_1" backgroundColor="#ffff0000">
                <button id="row_1_btn_1" text="1" font="roboto-medium" width="50" height="50" backgroundColor="#ff00ffff" />
                <button id="row_1_btn_2" text="2" font="roboto-medium" width="50" height="50" backgroundColor="#ffff00ff" />
            </GridRow>
            <GridRow id="row_2" backgroundColor="#ffff0000">
                <button id="row_2_btn_1" text="3" font="roboto-medium" width="50" height="50" backgroundColor="#ff000000" />
                <button id="row_2_btn_2" text="4" font="roboto-medium" width="50" height="50" backgroundColor="#ffffffff" textColor="0" />
            </GridRow>
        </GridView>

        <ListView id="list_view" x="10" y="240" width="200" height="200">
            <ListItem backgroundColor="#ffff0000" id="item_1" height="50" type="StdListField" text="red" textColor="#ffffffff" font="roboto-medium" />
            <ListItem backgroundColor="#ff00ff00" id="item_2" height="50" type="LeftArrowField" text="green" textColor="#ffffffff" font="roboto-medium" />
            <ListItem backgroundColor="#ff0000ff" id="item_3" height="50" type="AlarmField" text="blue" textColor="#ffffffff" font="roboto-medium" />
        </ListView>

        <key id="enter" onPress="ShowPopupCallback('test_popup')"/>
        <key id="escape" onLongPress="ClosePopupCallback()"/>


    </customView>
</doc>
